id,start_date,end_date,duration,info_source,news_link,continent,country,state/india,geo_scope,area_name,ordered_by,decision_maker,shutdown_type_new,affected_network,full_or_service-based,facebook_affected,twitter_affected,whatsapp_affected,instagram_affected,telegram_affected,other_service_details(specify),sms_affected,phone_call_affected,telcos_involved,gov_ack,official_just,other_just_details,off_statement,actual_cause,other_cause_details,election,violence,hr_abuse_reported,users_notified,users_affected/targetted,legal_justif,legal_method,telco_resp,telco_ack
67,2020-06-16,2020-06-17,1.0,news media article,https://www.greaterkashmir.com/news/front-page-2/3-more-militants-killed-in-shopian-19-in-10-days/,asia,india,jammu and kashmir,level 1,"shopian, in jammu and kashmir",local government,"inspector general of police, kashmir zone",shutdown,mobile,full network,no,no,no,no,no,,no,no,,yes,precautionary measure,prevent a law and order situation during and after security forces operation.,http://jkhome.nic.in/65(tsts)%20of%202020.pdf,political instability,security forces operation,no,yes,unknown,no,,yes,yes. the inspector general office of the kashmir zone issued a shutdown order to prevent mobilization and a law and order situation during security forces operation. the order was later confirmed by the principal secretary of government. order - 65(tsts) of 2020.,,unknown
68,2020-06-18,,,news media article,https://economictimes.indiatimes.com/news/politics-and-nation/locals-demand-restoration-of-mobile-services-to-ease-war-fear/articleshow/76202707.cms; https://economictimes.indiatimes.com/news/politics-and-nation/mobile-services-stay-shut-in-e-ladakh/articleshow/76329472.cms?from=mdr,asia,india,jammu and kashmir,level 2,leh (ladakh),military,,shutdown,mobile,full network,no,no,no,no,no,,yes,yes,,unknown,unknown,,,political instability,border conflict,no,no,unknown,no,,,,,unknown
69,2020-06-18,2020-06-19,1.0,news media article,https://www.thekashmirmonitor.net/pampore-gunfight-militant-killed-operation-on/;  https://kashmirlife.net/unidentified-militant-killed-in-ongoing-pampore-gunfight-police-237159/; http://jkhome.nic.in/67(tsts)of2020.pdf; http://jkhome.nic.in/69(tsts)of2020.pdf; http://jkhome.nic.in/68(tsts)of2020.pdf; http://jkhome.nic.in/70(tsts)of2020.pdf,asia,india,jammu and kashmir,level 1,"awantipora, pulwama,  in jammu and kashmir",local government,"inspector general of police, kashmir zone",shutdown,mobile,full network,no,no,no,no,no,,yes,yes,,yes,precautionary measure,prevent a law and order situation during and after security forces operation.,http://jkhome.nic.in/67(tsts)of2020.pdf,political instability,security forces operation,no,yes,unknown,no,,yes,yes. the inspector general office of the kashmir zone issued a shutdown order to prevent mobilization and a law and order situation during security forces operation. the order was later confirmed by the principal secretary of government. order - 67(tsts) of 2020; 69(tsts) of 2020; 68(tsts) of 2020; 70(tsts) of 2020.,,unknown
70,2020-06-18,2020-06-20,2.0,news media article,https://greaterjammu.com/1-militant-killed-in-shopian-encounter-mobile-internet-suspended/; http://jkhome.nic.in/71(tsts)of2020.pdf,asia,india,jammu and kashmir,level 1,"shopian, in jammu and kashmir",local government,"inspector general of police, kashmir zone",shutdown,mobile,full network,no,no,no,no,no,,no,no,,yes,precautionary measure,prevent a law and order situation during and after security forces operation.,http://jkhome.nic.in/71(tsts)of2020.pdf,political instability,security forces operations,no,yes,unknown,no,,yes,yes. the inspector general office of the kashmir zone issued a shutdown order to prevent mobilization and a law and order situation during security forces operation. the order was later confirmed by the principal secretary of government. order - 71(tsts) of 2020.,,unknown
71,2020-06-19,2020-06-19,0.0,news media article,https://netobservatory.by/belarus-shutdown-2020-en/,europe,belarus,,level 3,national,executive government,,shutdown,"broadband, mobile","full network, service-based",no,no,no,no,yes,viber and corporate vpn service providers,no,no,,no,unknown,,,other,preparation of shutdowns,no,no,no,no,,,,,no
72,2020-06-20,2020-06-21,1.0,news media article,https://www.presstrustofkashmir.com/2020/06/20/kulgam-encounter-militant-killed-search-on/; http://jkhome.nic.in/72(tsts)of2020.pdf,asia,india,jammu and kashmir,level 1,"shopian and kulgam, in jammu and kashmir",local government,"inspector general of police, kashmir zone",shutdown,mobile,full network,no,no,no,no,no,,no,no,,yes,precautionary measure,prevent a law and order situation during and after security forces operation.,http://jkhome.nic.in/72(tsts)of2020.pdf,political instability,security forces operations,no,yes,unknown,no,,yes,yes. the inspector general office of the kashmir zone issued a shutdown order to prevent mobilization and a law and order situation during security forces operation. the order was later confirmed by the principal secretary of government. order - 72(tsts) of 2020.,,unknown
73,2020-06-21,2020-06-21,0.0,other,https://www.thekashmirmonitor.net/caso-in-srinagar-mobile-internet-suspended/; http://jkhome.nic.in/73(tsts)of2020.pdf,asia,india,jammu and kashmir,level 1,"srinagar district, in jammu and kashmir",local government,"inspector general of police, kashmir zone",shutdown,mobile,full network,no,no,no,no,no,,no,no,,yes,precautionary measure,prevent a law and order situation during security forces operation.,http://jkhome.nic.in/73(tsts)of2020.pdf,political instability,security forces operation,no,yes,unknown,no,,yes,yes. the inspector general office of the kashmir zone issued a shut down order to prevent mobilization and a law and order situation during security forces operation. the order was later confirmed by the principal secretary of government.,,unknown
74,2020-06-22,2020-08-18,57.0,news media article,https://www.rfi.fr/fr/afrique/20200729-tchad-les-coupures-dinternet-multiplient-depuis-une-semaine?fbclid=iwar0prc29whsl1wkqsfw_uymxwrhxgvuzdpiwf_sp7dg5me48pcdulv-vhtg; https://www.aljazeera.com/news/2020/8/4/chad-slows-down-internet-to-curb-hate-speech-on-social-media;,africa,chad,,level 3,national,executive government,,"shutdown, throttle","broadband, mobile",service-based,no,no,yes,no,no,,no,no,"chad: airtel (bharti airtel), chad: sotel, chad: tigo (millicom)",yes,fake news/ hate speech/ incendiary content/ promoting violence,government spokesman mahamat zene cherif said late on monday a “temporary measure” to slow the internet was introduced on july 22 because of “the dissemination of messages inciting hate and division”.,https://www.aljazeera.com/news/2020/8/4/chad-slows-down-internet-to-curb-hate-speech-on-social-media,communal violence,,no,no,no,no,,no,,https://www.lefigaro.fr/flash-actu/le-tchad-limite-internet-pour-endiguer-les-messages-haineux-20200803,yes
75,2020-06-23,2020-06-23,0.0,other,http://jkhome.nic.in/74(tsts)of2020.pdf,asia,india,jammu and kashmir,level 1,"pulwama, in jammu and kashmir",local government,"inspector general of police, kashmir zone",shutdown,mobile,full network,no,no,no,no,no,,no,no,,yes,precautionary measure,prevent a law and order situation during and after security forces operation.,http://jkhome.nic.in/74(tsts)of2020.pdf,political instability,security forces operation,no,yes,unknown,no,,yes,yes. the inspector general office of the kashmir zone issued a shutdown order to prevent mobilization and a law and order situation during security forces operation. the order was later confirmed by the principal secretary of government. order - 74(tsts) of 2020.,,unknown
76,2020-06-25,2020-06-26,1.0,news media article,https://www.thepublish.in/two-militants-killed-in-sopore-mobile-internet-suspended; http://jkhome.nic.in/75(tsts)of2020.pdf,asia,india,jammu and kashmir,level 1,"sopore, in jammu and kashmir",local government,security forces operations,shutdown,mobile,full network,no,no,no,no,no,,no,no,,yes,precautionary measure,prevent a law and order situation during and after security forces operation.,http://jkhome.nic.in/75(tsts)of2020.pdf,political instability,prevent a law and order situation during and after security forces operation.,no,yes,unknown,no,,yes,yes. the inspector general office of the kashmir zone issued a shutdown order to prevent mobilization and a law and order situation during security forces operation. the order was later confirmed by the principal secretary of government. order - 75(tsts) of 2020.,,unknown
77,2020-06-25,2020-06-26,,news media article,https://thekashmirpress.com/2020/06/26/two-militant-killed-as-tral-gunfight-enters-second-day-internet-suspended/; http://www.thenewsnow.co.in/newsdet.aspx?q=110720; http://jkhome.nic.in/76(tsts)of2020.pdf,asia,india,jammu and kashmir,level 1,"pulwama, awantipora district, in jammu and kashmir",local government,"inspector general of police, kashmir zone",shutdown,mobile,full network,no,no,no,no,no,,no,no,,yes,precautionary measure,prevent a law and order situation during and after security forces operation.,http://jkhome.nic.in/76(tsts)of2020.pdf,political instability,security forces operation,no,yes,unknown,no,,yes,yes. the inspector general office of the kashmir zone issued a shutdown order to prevent mobilization and a law and order situation during security forces operation. the order was later confirmed by the principal secretary of government. order - 76(tsts) of 2020.,,unknown
78,2020-06-29,2020-06-29,0.0,news media article,http://thekashmiriyat.co.uk/encounter-breaks-out-in-anantnag-internet-suspended/; http://www.uniindia.com/encounter-ensues-in-anantnag-mobile-internet-suspended/north/news/2059269.html; http://jkhome.nic.in/77(tsts)of2020.pdf;,asia,india,jammu and kashmir,level 1,"anantnag, in jammu and kashmir",local government,"inspector general of police, kashmir zone",shutdown,mobile,full network,no,no,no,no,no,,no,no,,yes,precautionary measure,prevent a law and order situation during and after security forces operation.,http://jkhome.nic.in/77(tsts)of2020.pdf,political instability,security forces operation,no,yes,unknown,no,,yes,yes. the inspector general office of the kashmir zone issued a shutdown order to prevent mobilization and a law and order situation during security forces operation. the order was later confirmed by the principal secretary of government. order - 77(tsts) of 2020.,,unknown
79,2020-06-30,2020-06-30,0.0,other,http://jkhome.nic.in/78(tsts)of2020.pdf,asia,india,jammu and kashmir,level 1,"anantnag district, in jammu and kashmir",local government,"inspector general of police, kashmir zone",shutdown,mobile,full network,no,no,no,no,no,,no,no,,yes,precautionary measure,prevent a law and order situation during and after security forces operation.,http://jkhome.nic.in/78(tsts)of2020.pdf,political instability,security forces operation,no,yes,unknown,no,,yes,yes. the inspector general office of the kashmir zone issued a shutdown order to prevent mobilization and a law and order situation during security forces operation. the order was later confirmed by the principal secretary of government. order - 78(tsts) of 2020.,,unknown
80,2020-06-30,2020-07-01,1.0,other,http://jkhome.nic.in/79(tsts)2020.pdf,asia,india,jammu and kashmir,level 1,awantipora in jammu and kashmir,local government,"inspector general of police, kashmir zone",shutdown,mobile,full network,no,no,no,no,no,,no,no,,yes,precautionary measure,prevent a law and order situation during and after security forces operation.,http://jkhome.nic.in/79(tsts)2020.pdf,political instability,security forces operation,no,yes,unknown,no,,yes,yes. the inspector general office of the kashmir zone issued a shutdown order to prevent mobilization and a law and order situation during security forces operation. the order was later confirmed by the principal secretary of government. order - 79(tsts) of 2020.,,unknown
81,2020-06-30,2020-08-06,37.0,cso kio partners,https://www.accessnow.org/back-in-the-dark-ethiopia-shuts-down-internet-once-again/,africa,ethiopia,,level 3,national,executive government,,shutdown,"broadband, mobile",full network,yes,yes,yes,no,yes,,no,no,ethiopia: ethio telecom,yes,fake news/ hate speech/ incendiary content/ promoting violence,,,political instability,the assassination of a prominent musician lead to protests and excessive use of force and communal violence,no,yes,yes,no,,no,,,yes
82,2020-07-01,2020-07-23,22.0,cso kio partners,"https://smex.org/noexamshutdown-4-mena-countries-shut-down-the-internet-so-far-to-fight-cheating/; https://royanews.tv/news/218994
https://twitter.com/jo_osa/status/1278317849577226241",middle east,jordan,,level 3,national,executive government,ministry of education and telecommunications authority,shutdown,"broadband, mobile",service-based,yes,no,yes,no,yes,"imo, tango, line, viber",no,no,,yes,school exams,,https://royanews.tv/news/218994,exam cheating,,no,no,no,no,,no,,,unknown
83,2020-07-04,2020-07-05,1.0,news media article,https://kashmirpatriot.com/2020/07/04/kulgam-gunfight-another-militant-killed-toll-02-internet-suspended-search-on/; http://jkhome.nic.in/80(tsts)2020.pdf;,asia,india,jammu and kashmir,level 1,"kulgam, in jammu and kashmir",local government,"inspector general of police, kashmir zone",shutdown,mobile,full network,no,no,no,no,no,,no,no,,yes,precautionary measure,prevent a law and order situation during and after security forces operation.,http://jkhome.nic.in/80(tsts)2020.pdf,political instability,security forces operation,no,yes,unknown,no,,yes,yes. the inspector general office of the kashmir zone issued a shutdown order to prevent mobilization and a law and order situation during security forces operation. the order was later confirmed by the principal secretary of government. order - 80(tsts) of 2020.,,unknown
84,2020-07-07,2020-07-08,1.0,news media article,http://www.uniindia.com/militant-soldier-killed-in-ongoing-encounter-in-pulwama-internet-suspended/north/news/2069026.html; https://www.theweek.in/news/india/2020/07/07/jk-soldier-militant-killed-in-pulwama-encounter.html; http://jkhome.nic.in/81(tsts)2020.pdf;,asia,india,jammu and kashmir,level 1,"pulwama, in jammu and kashmir",local government,"inspector general of police, kashmir zone",shutdown,mobile,full network,no,no,no,no,no,,no,no,,yes,precautionary measure,prevent a law and order situation during and after security forces operation.,http://jkhome.nic.in/81(tsts)2020.pdf,political instability,security forces operation,no,yes,unknown,no,,yes,yes. the inspector general office of the kashmir zone issued a shutdown order to prevent mobilization and a law and order situation during security forces operation. the order was later confirmed by the principal secretary of government. order - 81(tsts) of 2020.,,unknown
85,2020-07-08,2020-07-08,0.0,news media article,https://www.tribuneindia.com/news/j-k/kashmir-shuts-down-on-burhans-4th-death-anniversary-110467; http://jkhome.nic.in/84(tsts)2020.pdf; http://jkhome.nic.in/83(tsts)2020.pdf;,asia,india,jammu and kashmir,level 2,"anantnag,kulgam,pulwama,shopian, in jammu and kashmir",local government,"inspector general of police, kashmir zone",shutdown,mobile,full network,no,no,no,no,no,,no,no,,yes,precautionary measure,"prevent a law and order situation given spread of material online due to the death anniversary of a ""terrorist"", burhan wani.",http://jkhome.nic.in/84(tsts)2020.pdf,religious holiday/anniversary,"fourth death anniversary of militant commander burhan wani, who was killed in a gunfight in south kashmir in 2016.",no,no,unknown,no,,yes,yes. the inspector general office of the kashmir zone issued a shutdown order to prevent mobilization and a law and order situation during security forces operation. the order was later confirmed by the principal secretary of government. order - 84(tsts) of 2020; 83(tsts) of 2020.,,unknown
86,2020-07-08,2020-07-22,14.0,news media article,https://yementime.com/news9899.html,middle east,yemen,,level 1,al-jawf,non-government,houthi militia (allegedly),shutdown,"broadband, mobile",full network,no,no,no,no,no,,no,no,"yemen: mtn, yemen: sabafon, yemen: y, yemen: yemen mobile",unknown,unknown,,,other,conflict,no,unknown,unknown,no,,,,,unknown
87,2020-07-10,2020-07-15,5.0,news media article,https://netblocks.org/reports/social-media-restricted-in-mali-amid-protests-against-president-qykpdx8d,africa,mali,,level 3,national,unknown,,"shutdown, throttle","broadband, mobile","full network, service-based",yes,yes,yes,yes,no,tv and radio stations were blocked,unknown,unknown,"mali: malitel (sotelma), mali: orange (sonatel), mali: telecel (atel)",unknown,unknown,,,protests,protests against president ibrahim boubacar keita's presidency.,no,yes,yes,no,,,,,unknown
88,2020-07-12,2020-07-13,1.0,news media article,https://www.timesnownews.com/india/article/jk-one-terrorist-gunned-down-by-security-forces-in-sopore-operation-still-underway/620264;  http://www.thenorthlines.com/3-terrorists-killed-in-sopore-encounter/;  http://jkhome.nic.in/85(tsts)2020.pdf,asia,india,jammu and kashmir,level 1,sopore,local government,"inspector general of police, kashmir zone",shutdown,mobile,full network,no,no,no,no,no,,no,no,,yes,precautionary measure,prevent a law and order situation during and after security forces operation.,http://jkhome.nic.in/85(tsts)2020.pdf,political instability,security forces operation,no,yes,unknown,no,,yes,yes. the inspector general office of the kashmir zone issued a shutdown order to prevent mobilization and a law and order situation during security forces operation. the order was later confirmed by the principal secretary of government. order - 85(tsts) of 2020.,,unknown
89,2020-07-13,2020-07-13,0.0,news media article,https://timesofindia.indiatimes.com/india/jaish-duo-killed-civilian-injured-in-anantnag-encounter/articleshow/76947149.cms; http://jkhome.nic.in/86(tsts)2020.pdf,asia,india,jammu and kashmir,level 1,"anantnag, in jammu and kashmir",local government,"inspector general of police, kashmir zone",shutdown,mobile,full network,no,no,no,no,no,,no,no,,yes,precautionary measure,prevent a law and order situation during and after security forces operation.,http://jkhome.nic.in/86(tsts)2020.pdf,political instability,security forces operation,no,yes,unknown,no,,yes,yes. the inspector general office of the kashmir zone issued a shutdown order to prevent mobilization and a law and order situation during security forces operation. the order was later confirmed by the principal secretary of government. order - 86(tsts) of 2020.,,unknown
90,2020-07-17,2020-07-18,1.0,other,http://jkhome.nic.in/87(tsts)2020.pdf,asia,india,jammu and kashmir,level 1,"kulgam district, in jammu and kashmir",local government,"inspector general of police, kashmir zone",shutdown,mobile,full network,no,no,no,no,no,,no,no,,yes,precautionary measure,prevent a law and order situation during and after security forces operation.,http://jkhome.nic.in/87(tsts)2020.pdf,political instability,security forces operation,no,yes,unknown,no,,yes,yes. the inspector general office of the kashmir zone issued a shutdown order to prevent mobilization and a law and order situation during security forces operation. the order was later confirmed by the principal secretary of government. order - 87(tsts) of 2020.,,unknown
91,2020-07-18,2020-07-19,1.0,news media article,http://www.uniindia.com/shopwian-encounter-3-militants-killed-internet-suspended/north/news/2084458.html; http://jkhome.nic.in/88(tsts)2020.pdf,asia,india,jammu and kashmir,level 1,"shopian, in jammu and kashmir",local government,"inspector general of police, kashmir zone",shutdown,mobile,full network,no,no,no,no,no,,no,no,,yes,precautionary measure,prevent a law and order situation during and after security forces operation.,http://jkhome.nic.in/88(tsts)2020.pdf,political instability,security forces operation,no,yes,unknown,no,,yes,yes. the inspector general office of the kashmir zone issued a shutdown order to prevent mobilization and a law and order situation during security forces operation. the order was later confirmed by the principal secretary of government. order - 88(tsts) of 2020.,,unknown
92,2020-07-22,,,news media article,http://www.ypagency.net/279308,middle east,yemen,,level 3,"amran governorate, saada, sana'a and  al-jawf (15 districts)",unknown,communications networks were bombed,shutdown,"broadband, mobile",full network,no,no,no,no,no,,no,no,,yes,unknown,,,political instability,air bombing of communication towers,no,yes,unknown,no,,unknown,,,unknown
93,2020-07-29,2020-08-11,13.0,news media article,https://twitter.com/netblocks/status/1288499466828382208?ref_src=twsrc%5etfw%7ctwcamp%5etweetembed%7ctwterm%5e1288499466828382208%7ctwgr%5e%7ctwcon%5es1_&ref_url=https%3a%2f%2fnetblocks.org%2freports%2ffacebook-live-streams-restricted-in-jordan-during-teachers-syndicate-protests-xb7k1xb7; https://rsf.org/en/news/jordan-bans-coverage-teachers-protests,middle east,jordan,,level 3,national,unknown,,"shutdown, throttle","broadband, mobile","full network, service-based",yes,no,no,no,no,,no,no,,no,unknown,,,protests,,no,yes,yes,no,,,,,no
94,2020-08-09,2020-12-07,120.0,news media article,https://netobservatory.by/belarus-shutdown-2020-en/,europe,belarus,,level 3,national,executive government,,"shutdown, throttle","broadband, mobile","full network, service-based",yes,yes,yes,yes,yes,"youtube, viber",unknown,unknown,,unknown,national security/ counter-terrorism,,,elections,elections and protests,yes,yes,yes,no,,,,,yes
95,2020-08-15,2020-08-15,0.0,news media article,https://www.deccanherald.com/national/north-and-central/mobile-internet-services-snapped-in-kashmir-as-independence-day-precautionary-measure-873564.html; https://www.ndtv.com/india-news/independence-day-2020-kashmir-mobile-internet-restored-after-usual-august-15-blackout-2280016,asia,india,jammu and kashmir,level 2,"anantnag,badgam,bandipora,baramulla,doda,ganderbal,jammu,kargil,kathua,kishtwar,kulgam,kupwara,leh (ladakh),poonch,pulwama,rajouri,ramban,reasi,samba,shupiyan,srinagar,udhampur, in jammu and kashmir",local government,"inspector general of police, kashmir zone",shutdown,mobile,full network,no,no,no,no,no,,no,no,,yes,precautionary measure,"mobile internet was snapped in the early hours of the morning as strict security arrangements were put in place for independence day celebrations across the valley, a police official said.

https://www.ndtv.com/india-news/independence-day-2020-kashmir-mobile-internet-restored-after-usual-august-15-blackout-2280016",http://jkhome.nic.in/90(tsts)of2020.pdf,religious holiday/anniversary,independence day,no,no,no,unknown,,yes,"yes. the inspector general office of the kashmir zone issued a shutdown order to prevent ""protests"", ""terrorist"" activities and a ""law and order situation"" during independence day. the order was later confirmed by the principal secretary of government. order - 90(tsts) of 2020.",,unknown
96,2020-08-17,2020-08-18,1.0,other,http://jkhome.nic.in/92(tsts)of2020.pdf,asia,india,jammu and kashmir,level 1,kreeri/pattan in baramulla district,local government,"inspector general of police, kashmir zone",shutdown,mobile,full network,no,no,no,no,no,,no,no,,yes,precautionary measure,prevent a law and order situation during and after security forces operation.,http://jkhome.nic.in/92(tsts)of2020.pdf,political instability,security forces operation,no,yes,unknown,no,,yes,yes. the inspector general office of the kashmir zone issued a shutdown order to prevent mobilization and a law and order situation during security forces operation. the order was later confirmed by the principal secretary of government. order - 92(tsts) of 2020.,,unknown
97,2020-08-18,,,news media article,https://www.rfi.fr/fr/afrique/20200729-tchad-les-coupures-dinternet-multiplient-depuis-une-semaine?fbclid=iwar0prc29whsl1wkqsfw_uymxwrhxgvuzdpiwf_sp7dg5me48pcdulv-vhtg; https://www.aljazeera.com/news/2020/8/4/chad-slows-down-internet-to-curb-hate-speech-on-social-media;,africa,chad,,level 3,national,executive government,,shutdown,"broadband, mobile",service-based,no,no,yes,no,no,,no,no,"chad: airtel (bharti airtel), chad: sotel, chad: tigo (millicom)",yes,fake news/ hate speech/ incendiary content/ promoting violence,,,communal violence,communal violence,no,no,no,no,,no,,,no
98,2020-08-19,2020-08-20,1.0,other,http://jkhome.nic.in/93(tsts)of2020.pdf,asia,india,jammu and kashmir,level 1,molu chitragam in the district of shopian,local government,"inspector general of police, kashmir zone",shutdown,mobile,full network,no,no,no,no,no,,no,no,,yes,precautionary measure,prevent a law and order situation during and after security forces operation.,http://jkhome.nic.in/93(tsts)of2020.pdf,political instability,security forces operation,no,yes,unknown,no,,yes,yes. the inspector general office of the kashmir zone issued a shutdown order to prevent mobilization and a law and order situation during security forces operation. the order was later confirmed by the principal secretary of government. order - 93(tsts) of 2020.,,unknown
99,2020-08-19,,,news media article,https://www.alayyam.info/news/8b59f8l0-xqcthp-de46,middle east,yemen,,level 1,"zanzibar city, abyan district",non-government,unknown groups vandalised telecom infrastructure in the city,shutdown,mobile,full network,no,no,no,no,no,,no,no,,yes,unknown,,,unknown,unknown groups vandalised telecom infrastructure in the city,no,no,no,no,,no,,,no
