id,start_date,end_date,duration,info_source,news_link,continent,country,state/india,geo_scope,area_name,ordered_by,decision_maker,shutdown_type_new,affected_network,full_or_service-based,facebook_affected,twitter_affected,whatsapp_affected,instagram_affected,telegram_affected,other_service_details(specify),sms_affected,phone_call_affected,telcos_involved,gov_ack,official_just,other_just_details,off_statement,actual_cause,other_cause_details,election,violence,hr_abuse_reported,users_notified,users_affected/targetted,legal_justif,legal_method,telco_resp,telco_ack
34,2020-04-10,2020-04-10,0.0,other,http://jkhome.nic.in/26(tsts)2020.pdf,asia,india,jammu and kashmir,level 1,"kupwara district, in jammu and kashmir",local government,"inspector general of police, kashmir zone",shutdown,mobile,full network,no,no,no,no,no,,no,no,,yes,precautionary measure,likelihood of misuse of data services - uploading inciting/objectionable materials,http://jkhome.nic.in/26(tsts)2020.pdf,political instability,,no,unknown,unknown,no,,yes,yes. the inspector general office of the kashmir zone issued a shutdown order to prevent mobilization and a law and order situation during security forces operation. the order was later confirmed by the principal secretary of government. order - 26(tsts) of 2020.,,unknown
35,2020-04-11,2020-04-11,0.0,other,http://jkhome.nic.in/27(tsts)2020.pdf,asia,india,jammu and kashmir,level 1,"kulgam, in jammu and kashmir",local government,igp kashmir,shutdown,mobile,full network,no,no,no,no,no,,no,no,,yes,precautionary measure,,,political instability,security forces operation,no,unknown,unknown,no,,yes,"the igp, kashmir zone, ordered shut down of 2g services in kulgam on 11.03.2020 as a precautionary measure to prevent mobilization of locals and law and order situation.",,unknown
36,2020-04-17,2020-04-17,0.0,other,http://jkhome.nic.in/29(tsts)2020.pdf,asia,india,jammu and kashmir,level 1,"shopian district, in jammu and kashmir",local government,"inspector general of police, kashmir zone",shutdown,mobile,full network,no,no,no,no,no,,no,no,,yes,precautionary measure,prevent a law and order situation during and after security forces operation.,http://jkhome.nic.in/29(tsts)2020.pdf,political instability,security forces operation,no,yes,unknown,no,,yes,yes. the inspector general office of the kashmir zone issued a shutdown order to prevent mobilization and a law and order situation during security forces operation. the order was later confirmed by the principal secretary of government. order - 29(tsts) of 2020.,,unknown
37,2020-04-21,2020-04-22,1.0,other,http://jkhome.nic.in/30(tsts)2020.pdf; http://jkhome.nic.in/31(tsts)2020.pdf,asia,india,jammu and kashmir,level 1,shopian and anantnag in jammu and kashmir,local government,"inspector general of police, kashmir zone",shutdown,mobile,full network,no,no,no,no,no,,no,no,,yes,precautionary measure,prevent a law and order situation during security forces operation.,http://jkhome.nic.in/30(tsts)2020.pdf; http://jkhome.nic.in/31(tsts)2020.pdf;,political instability,security forces operation,no,yes,unknown,no,,yes,yes. the inspector general office of the kashmir zone issued a shutdown order to prevent mobilization and a law and order situation during security forces operation. the order was later confirmed by the principal secretary of government. order - 30(tsts) of 2020.; yes. the inspector general office of the kashmir zone issued a shutdown order to prevent mobilization and a law and order situation during security forces operation. the order was later confirmed by the principal secretary of government. order - 31(tsts) of 2020.,,
38,2020-04-25,2020-04-25,0.0,news media article,http://jkhome.nic.in/32(tsts)2020.pdf,asia,india,jammu and kashmir,level 2,"kulgam district and awantipora, in jammu and kashmir",local government,"inspector general of police, kashmir zone",shutdown,mobile,full network,no,no,no,no,no,,no,no,,yes,precautionary measure,prevent a law and order situation during security forces operation.,http://jkhome.nic.in/32(tsts)2020.pdf,political instability,security forces operation,no,yes,unknown,no,,yes,yes. the inspector general office of the kashmir zone issued a shutdown order to prevent mobilization and a law and order situation during security forces operation. the order was later confirmed by the principal secretary of government. order - 32(tsts) of 2020.,,unknown
39,2020-04-26,2020-04-26,0.0,news media article,https://zeenews.india.com/india/encounter-breaks-out-between-security-forces-and-terrorists-in-jammu-and-kashmirs-kulgam-2279361.html; http://jkhome.nic.in/33(tsts)2020.pdf,asia,india,jammu and kashmir,level 1,"kulgam, in jammu and kashmir",local government,"inspector general of police, kashmir zone",shutdown,mobile,full network,no,no,no,no,no,,no,no,,yes,precautionary measure,"""as a precautionary measure, the authorities have suspended mobile internet in the district."" https://zeenews.india.com/india/encounter-breaks-out-between-security-forces-and-terrorists-in-jammu-and-kashmirs-kulgam-2279361.html",http://jkhome.nic.in/33(tsts)2020.pdf,political instability,security forces operation,no,yes,unknown,no,,yes,yes. the inspector general office of the kashmir zone issued a shutdown order to prevent mobilization and a law and order situation during security forces operation. the order was later confirmed by the principal secretary of government. order - 33(tsts) of 2020.,,unknown
40,2020-04-27,2020-04-27,0.0,other,http://jkhome.nic.in/35(tsts)of%202020.pdf,asia,india,jammu and kashmir,level 1,anantnag,local government,"inspector general of police, kashmir zone",shutdown,mobile,full network,no,no,no,no,no,,no,no,,yes,precautionary measure,prevent a law and order situation during and after security forces operation.,http://jkhome.nic.in/35(tsts)of%202020.pdf,political instability,security forces operation,no,yes,unknown,no,,yes,yes. the inspector general office of the kashmir zone issued a shutdown order to prevent mobilization and a law and order situation during security forces operation. the order was later confirmed by the principal secretary of government. order - 35(tsts) of 2020.,,unknown
41,2020-04-28,2020-04-30,2.0,other,http://jkhome.nic.in/38(tsts)of2020.pdf; http://jkhome.nic.in/37(tsts)of2020.pdf; http://jkhome.nic.in/36(tsts)of2020.pdf,asia,india,jammu and kashmir,level 2,"shopian, anantnag, and pulwama districts, in jammu and kashmir",local government,"inspector general of police, kashmir zone",shutdown,mobile,full network,no,no,no,no,no,,no,no,,yes,precautionary measure,prevent a law and order situation during and after security forces operation.,http://jkhome.nic.in/38(tsts)of2020.pdf,other,security forces operation,no,yes,unknown,no,,yes,yes. the inspector general office of the kashmir zone issued a shutdown order to prevent mobilization and a law and order situation during security forces operation. the order was later confirmed by the principal secretary of government. order - 38(tsts) of 2020; 37(tsts) of 2020; 36(tsts) of 2020.,,unknown
42,2020-05-02,2020-05-03,1.0,news media article,https://www.indiatoday.in/india/story/jammu-kashmir-kupwara-handwara-encounter-operation-indian-army-millitants-jawans-martyred-1673820-2020-05-03; http://jkhome.nic.in/42(tsts)of2020.pdf; http://jkhome.nic.in/41(tsts)of2020.pdf,asia,india,jammu and kashmir,level 1,"kupwara, in jammu and kashmir",local government,"inspector general of police, kashmir zone",shutdown,mobile,full network,no,no,no,no,no,,no,no,,yes,precautionary measure,prevent a law and order situation during and after security forces operation.,http://jkhome.nic.in/42(tsts)of2020.pdf,political instability,security forces operation,no,yes,unknown,no,,yes,yes. the inspector general office of the kashmir zone issued a shutdown order to prevent mobilization and a law and order situation during security forces operation. the order was later confirmed by the principal secretary of government. order - 42(tsts) of 2020; 41(tsts) of 2020.,,unknown
43,2020-05-02,2020-05-02,0.0,other,http://jkhome.nic.in/39(tsts)of2020.pdf,asia,india,jammu and kashmir,level 1,"pulwama district, in jammu and kashmir",local government,"inspector general of police, kashmir zone",shutdown,mobile,full network,no,no,no,no,no,,no,no,,yes,precautionary measure,prevent a law and order situation during security forces operation.,http://jkhome.nic.in/39(tsts)of2020.pdf,political instability,security forces operation,no,yes,unknown,no,,yes,yes. the inspector general office of the kashmir zone issued a shutdown order to prevent mobilization and a law and order situation during security forces operation. the order was later confirmed by the principal secretary of government. order - 39(tsts) of 2020.,,unknown
44,2020-05-05,2020-05-05,0.0,other,http://jkhome.nic.in/43(tsts)of2020.pdf,asia,india,jammu and kashmir,level 1,"kupwara, in jammu and kashmir",local government,"inspector general of police, kashmir zone",shutdown,mobile,full network,no,no,no,no,no,,no,no,,yes,precautionary measure,prevent a law and order situation during and after security forces operation.,http://jkhome.nic.in/43(tsts)of2020.pdf,political instability,security forces operation,no,yes,unknown,no,,yes,yes. the inspector general office of the kashmir zone issued a shutdown order to prevent mobilization and a law and order situation during security forces operation. the order was later confirmed by the principal secretary of government. order - 43(tsts) of 2020.,,unknown
45,2020-05-05,2020-05-05,0.0,other,http://jkhome.nic.in/44(tsts)of2020.pdf,asia,india,jammu and kashmir,level 1,"district of ramban, in jammu and kashmir",local government,"inspector general of police, kashmir zone",shutdown,mobile,full network,no,no,no,no,no,,no,no,,yes,fake news/ hate speech/ incendiary content/ promoting violence,prevent the spread of provocation material on social media,http://jkhome.nic.in/44(tsts)of2020.pdf,political instability,prevent the spread of material on social media that might create a law and order situation,no,unknown,unknown,no,,yes,"yes. the inspector general office of the kashmir zone issued a shutdown order to prevent spread of ""provocation material on social media"" that might have created a law and order situation. the order was later confirmed by the principal secretary of government. order - 44(tsts) of 2020.",,unknown
46,2020-05-06,2020-05-07,1.0,news media article,http://jkhome.nic.in/45(tsts)of2020.pdf;,asia,india,jammu and kashmir,level 1,awantipora,local government,"inspector general of police, kashmir zone",shutdown,mobile,full network,no,no,no,no,no,,yes,yes,,yes,precautionary measure,prevent a law and order situation after security forces operation.,http://jkhome.nic.in/45(tsts)of2020.pdf,political instability,security forces operation,no,yes,unknown,no,,yes,yes. the inspector general office of the kashmir zone issued a shutdown order to prevent mobilization and a law and order situation during security forces operation. the order was later confirmed by the principal secretary of government. order - 45(tsts) of 2020;,,unknown
47,2020-05-06,2020-05-13,,news media article,"http://jkhome.nic.in/46(tsts)of2020.pdf
http://jkhome.nic.in/47(tsts)of2020.pdf  
http://jkhome.nic.in/48(tsts)of%202020.pdf http://jkhome.nic.in/49(tsts)of2020.pdf",asia,india,jammu and kashmir,level 1,kashmir valley,local government,"inspector general of police, kashmir zone",shutdown,mobile,full network,no,no,no,no,no,,yes,yes,,yes,precautionary measure,prevent a law and order situation after security forces operation.,http://jkhome.nic.in/46(tsts)of2020.pdf,political instability,security forces operation,no,yes,unknown,no,,yes,yes. the inspector general office of the kashmir zone issued a shutdown order to prevent mobilization and a law and order situation during security forces operation. the order was later confirmed by the principal secretary of government. order - 46(tsts) of 2020; 47(tsts) of 2020; 48(tsts) of 2020; 49(tsts) of 2020.,,unknown
48,2020-05-12,2020-05-17,5.0,news media article,https://www.medianama.com/2020/05/223-mobile-data-shut-down-hooghly-bengal/; https://www.timesnownews.com/india/article/violence-erupts-over-movement-in-containment-zones-in-wb-governor-says-state-cannot-afford-communal-virus/591082,asia,india,west bengal,level 1,"chandannagar and serampore subdivision of hoogly, in the state of west bengal",local government,district magistrate,shutdown,mobile,full network,no,no,no,no,no,,no,no,,yes,public safety/ quell unrest / restore public order,,,communal violence,the restrictions reportedly came after communal clashes broke out in those areas when some people crossed over containment zone limits to use a public toilet.,no,yes,unknown,no,,unknown,,,unknown
49,2020-05-12,2020-05-27,15.0,other,http://jkhome.nic.in/48(tsts)of%202020.pdf,asia,india,,level 2,"all districts from jammu and kashmir, but for ganderbal and udhampur g",local government,principal secretary to the government home department of jammu and kashmir,"shutdown, throttle",mobile,full network,no,no,no,no,no,,no,no,,yes,precautionary measure,"preempt terrorist activity, recruiting, and disruption of public order during the election process to the 280 district development council constituencies and bye-eye elections to more than 13400 vacancies in pris/urbs.",http://jkhome.nic.in/48(tsts)of%202020.pdf,political instability,,no,no,unknown,no,,yes,"yes. the principal secretary to the government justified the shutdown as an attempt to preempt terrorist activity, recruiting, and disruption of public order during the election process to the 280 district development council constituencies and bye-eye elections to more than 13400 vacancies in pris/urbs.",,unknown
50,2020-05-13,2020-05-14,1.0,news media article,https://apnews.com/article/d5771b32be4a13581282e58e6f67465e; http://jkhome.nic.in/50(tsts)of2020.pdf,asia,india,jammu and kashmir,level 1,badgam,local government,"inspector general of police, kashmir zone",shutdown,mobile,full network,no,no,no,no,no,,no,no,,yes,precautionary measure,likelihood of misuse of data services to mobilize locals and disturb law and order,http://jkhome.nic.in/50(tsts)of2020.pdf,protests,authorities shut down mobile internet service due to a protest on the shooting of a civilian by security forces (india’s central reserve police force) in a checkpoint.,no,yes,yes,no,,yes,yes. the inspector general office of the kashmir zone issued a shutdown order to prevent mobilization and a law and order situation. the order was later confirmed by the principal secretary of government. order - 50(tsts) of 2020.,,unknown
51,2020-05-14,2020-05-16,2.0,news media article,https://www.dabangasudan.org/en/all-news/article/precautionary-mobile-internet-slowdown-in-sudan-s-kassala,africa,sudan,,level 1,kassala,unknown,,shutdown,mobile,full network,no,no,no,no,no,,unknown,no,"sudan: mtn, sudan: sudani (sudatel), sudan: zain",unknown,other,precautionary measure,,communal violence,clash between communities,no,no,no,no,,,,,no
52,2020-05-14,2020-05-14,0.0,news media article,http://jkhome.nic.in/51(tsts)of2020.pdf,asia,india,jammu and kashmir,level 1,"kulgam, in jammu and kashmir",local government,"inspector general of police, kashmir zone",shutdown,mobile,full network,no,no,no,no,no,,no,no,,yes,precautionary measure,prevent a law and order situation during security forces operation.,http://jkhome.nic.in/51(tsts)of2020.pdf,political instability,security forces operation,no,yes,unknown,no,,yes,the inspector general office of the kashmir zone issued a shut down order to prevent mobilization and a law and order situation during security forces operation. the order was later confirmed by the principal secretary of government.,,no
53,2020-05-18,2020-05-18,0.0,cso kio partners,,asia,pakistan,,level 3,,unknown,,shutdown,"broadband, mobile",service-based,no,yes,no,no,no,,no,no,"pakistan: jazz (global telecom), pakistan: ptcl, pakistan: qubee (augere), pakistan: special communications organization, pakistan: telenor, pakistan: wateen telecom (abu dhabi), pakistan: wi-tribe, pakistan: zong (china mobile)",no,unknown,,,unknown,,no,no,no,no,,,,,no
54,2020-05-18,2020-05-22,4.0,news media article,https://theprint.in/india/internet-services-snapped-in-srinagar-after-crpf-jawan-cop-injured-in-encounter/424671/; https://indianexpress.com/article/india/kashmir-srinagar-encounter-militants-crpf-police-mobile-internet-live-updates-6416582/,asia,india,jammu and kashmir,level 1,srinagar in jammu and kashmir,unknown,,shutdown,mobile,full network,no,no,no,no,no,,yes,yes,,yes,precautionary measure,"""the official said mobile internet and mobile telephony services, except on bsnl postpaid, have been snapped in the city as a precautionary measure.""",,political instability,security forces operations,no,yes,unknown,no,,unknown,,,
55,2020-05-19,2020-05-20,1.0,other,http://jkhome.nic.in/54(tsts)of2020.pdf,asia,india,jammu and kashmir,level 1,"pulwama district, in jammu and kashmir",local government,"inspector general of police, kashmir zone",shutdown,mobile,full network,no,no,no,no,no,,no,no,,yes,precautionary measure,prevent a law and order situation during and after security forces operation.,http://jkhome.nic.in/54(tsts)of2020.pdf,political instability,security forces operation,no,yes,unknown,no,,yes,yes. the inspector general office of the kashmir zone issued a shutdown order to prevent mobilization and a law and order situation during security forces operation. the order was later confirmed by the principal secretary of government. order - 54(tsts) of 2020.,,unknown
56,2020-05-20,2020-05-21,1.0,news media article,https://www.accessnow.org/keepiton-burundi-silences-the-majority-on-election-day/; https://netblocks.org/reports/social-media-disrupted-in-burundi-on-election-day-jbzlpy86;,africa,burundi,,level 3,national,unknown,,shutdown,mobile,service-based,yes,yes,yes,yes,yes,youtube and other google services,no,no,"burundi: econet leo, burundi: lumitel (viettel), burundi: onamob (onatel)",no,unknown,,,elections,,yes,unknown,no,no,,,,,no
57,2020-05-25,2020-05-25,0.0,news media article,https://www.indiatoday.in/india/story/jammu-and-kashmir-encounter-kulgam-damhal-hanjipora-militants-live-updates-1681544-2020-05-25; http://jkhome.nic.in/55(tsts)of2020.pdf,asia,india,jammu and kashmir,level 2,kulgam and shopian,local government,"inspector general of police, kashmir zone",shutdown,mobile,full network,no,no,no,no,no,,no,no,,yes,precautionary measure,prevent a law and order situation during and after security forces operation.,http://jkhome.nic.in/55(tsts)of2020.pdf,political instability,security forces operation,no,yes,unknown,no,,yes,yes. the inspector general office of the kashmir zone issued a shutdown order to prevent mobilization and a law and order situation during security forces operation. the order was later confirmed by the principal secretary of government. order - 55(tsts) of 2020.,,unknown
58,2020-05-30,2020-05-30,0.0,news media article,https://www.hindustantimes.com/cities/two-militants-killed-in-encounter-in-kashmir-s-kulgam-district/story-hrjhb79rikctu6dycjiojn.html; http://jkhome.nic.in/57(tsts)2020.pdf,asia,india,jammu and kashmir,level 1,kulgam,local government,"inspector general of police, kashmir zone",shutdown,mobile,full network,no,no,no,no,no,,no,no,,yes,precautionary measure,"inspector general of police, kashmir zone",http://jkhome.nic.in/57(tsts)2020.pdf,political instability,security forces operation,no,yes,unknown,no,,yes,yes. the inspector general office of the kashmir zone issued a shutdown order to prevent mobilization and a law and order situation during security forces operation. the order was later confirmed by the principal secretary of government. order - 57(tsts) of 2020.,,unknown
59,2020-05-31,2020-05-31,0.0,news media article,http://jkhome.nic.in/58(tsts)2020.pdf,asia,india,jammu and kashmir,level 1,"anantnag, in jammu and kashmir",local government,"inspector general of police, kashmir zone",shutdown,mobile,full network,no,no,no,no,no,,no,no,,yes,precautionary measure,prevent a law and order situation during and after security forces operation.,http://jkhome.nic.in/58(tsts)2020.pdf,political instability,security forces operation,no,yes,unknown,no,,yes,yes. the inspector general office of the kashmir zone issued a shutdown order to prevent mobilization and a law and order situation during security forces operation. the order was later confirmed by the principal secretary of government. order - 58(tsts) of 2020.,,unknown
60,2020-05-31,2020-05-31,0.0,cso kio partners,https://twitter.com/vesinfiltro/status/1267136497880387584,latin america,venezuela (bolivarian republic of),,level 3,,unknown,,shutdown,"broadband, mobile",service-based,no,no,no,yes,no,youtube,no,no,,no,unknown,,,other,blocking during a session in the national assembly,no,no,no,no,,,,,
61,2020-06-02,2020-06-02,0.0,news media article,https://kashmir.today/tral-gunfight-2-militants-killed-internet-snapped-in-area/; http://jkhome.nic.in/59(tsts)2020.pdf,asia,india,jammu and kashmir,level 1,"awantipora, in jammu and kashmir",local government,"inspector general of police, kashmir zone",shutdown,mobile,full network,no,no,no,no,no,,no,no,,yes,precautionary measure,prevent a law and order situation during and after security forces operation.,http://jkhome.nic.in/59(tsts)2020.pdf,political instability,security forces operations,no,yes,unknown,no,,yes,yes. the inspector general office of the kashmir zone issued a shutdown order to prevent mobilization and a law and order situation during security forces operation. the order was later confirmed by the principal secretary of government. order - 59(tsts) of 2020.,,unknown
62,2020-06-03,2020-06-05,2.0,news media article,https://www.indiatoday.in/india/story/jaish-terrorists-killed-in-kashmir-pulwama-encounter-1684932-2020-06-03; https://www.timesnownews.com/india/article/encounter-breaks-out-between-security-forces-terrorists-in-jks-pulwama-internet-services-snapped/600764; http://jkhome.nic.in/60(tsts)%20of%202020.pdf,asia,india,jammu and kashmir,level 1,"pulwama, in jammu and kashmir",local government,"inspector general of police, kashmir zone",shutdown,mobile,full network,no,no,no,no,no,,no,no,,yes,precautionary measure,prevent a law and order situation during and after security forces operation.,http://jkhome.nic.in/60(tsts)%20of%202020.pdf,political instability,security forces operation,no,yes,unknown,no,,yes,yes. the inspector general office of the kashmir zone issued a shutdown order to prevent mobilization and a law and order situation during security forces operation. the order was later confirmed by the principal secretary of government. order - 60(tsts) of 2020.,,unknown
63,2020-06-07,2020-06-08,1.0,news media article,https://www.indiatoday.in/india/story/jammu-and-kashmir-shopian-encounter-reban-1686366-2020-06-07; https://www.greaterkashmir.com/news/front-page-2/5-hm-militants-killed-in-shopian/; http://jkhome.nic.in/62(tsts)%20of%202020.pdf; http://jkhome.nic.in/61(tsts)%20of%202020.pdf,asia,india,jammu and kashmir,level 1,"shopian and kulgam district, in jammu and kashmir",local government,"inspector general of police, kashmir zone",shutdown,mobile,full network,no,no,no,no,no,,no,no,,yes,precautionary measure,prevent a law and order situation during and after security forces operation.,http://jkhome.nic.in/62(tsts)%20of%202020.pdf,political instability,security forces operation,no,yes,unknown,no,,yes,yes. the inspector general office of the kashmir zone issued a shutdown order to prevent mobilization and a law and order situation during security forces operation. the order was later confirmed by the principal secretary of government. order - 62(tsts) of 2020; 61(tsts) of 2020.,,unknown
64,2020-06-10,2020-06-12,2.0,news media article,https://www.greaterkashmir.com/news/latest-news/shopian-gunfight-over-three-militants-killed-internet-snapped/; http://jkhome.nic.in/63(tsts)%20of%202020.pdf,asia,india,jammu and kashmir,level 1,"shopian district, in jammu kashmir",local government,"inspector general of police, kashmir zone",shutdown,mobile,full network,no,no,no,no,no,,no,no,,yes,precautionary measure,"""mobile internet has been suspended in the shopian district as a precautionary measure, said another official.""",http://jkhome.nic.in/63(tsts)%20of%202020.pdf,political instability,security forces operation,no,yes,unknown,no,,yes,yes. the inspector general office of the kashmir zone issued a shutdown order to prevent mobilization and a law and order situation during security forces operation. the order was later confirmed by the principal secretary of government. order - 63(tsts) of 2020.,,unknown
65,2020-06-11,2020-06-11,0.0,news media article,https://twitter.com/valeriabet/status/1270871388136648704;,latin america,ecuador,,level 3,,unknown,,shutdown,"broadband, mobile",service-based,no,yes,no,no,no,,no,no,,no,unknown,,,unknown,,no,no,unknown,no,,,,,no
66,2020-06-13,2020-06-14,1.0,news media article,https://www.tribuneindia.com/news/j-k/two-militants-killed-in-kulgam-gunfight-98727; http://jkhome.nic.in/64(tsts)%20of%202020.pdf,asia,india,jammu and kashmir,level 1,kulgam,local government,"inspector general of police, kashmir zone",shutdown,mobile,full network,no,no,no,no,no,,no,no,,yes,precautionary measure,mobile internet services were shut down to prevent a law and order situation during and after security forces operation in,http://jkhome.nic.in/64(tsts)%20of%202020.pdf,political instability,security forces operation,no,yes,unknown,no,,yes,yes. the inspector general office of the kashmir zone issued a shutdown order to prevent mobilization and a law and order situation during security forces operation. the order was later confirmed by the principal secretary of government. order - 64(tsts) of 2020.,,unknown
